title,score
"AMA with Adin from Kalshi, The First Legal Prediction Market in America",10
"Daily Crypto Discussion - March 9, 2025 (GMT+0)",18
Trump does not understand Bitcoin,2330
Michael Saylor pushes US gov’t to purchase up to 25% of Bitcoin supply,142
"XRP, Solana, Cardano's ADA Prices Drop as White House Backpedals on Trump's Crypto Reserve Plan",517
David Sacks says the US may have lost over $16 billion in early liquidation of bitcoins,188
"El Salvador acquired over 13 BTC since March 1, despite IMF deal",171
U.S. crypto firms’ push for deregulation and political contributions raises ‘red flags’: Report,139
This Malicious PyPI Package Stole Ethereum Private Keys via Polygon RPC Transactions,39
Saylor' greed turns Bitcoin into Wall St lapdog,304
"✨ 12 years ago today, the media mistakenly claimed this man was Satoshi Nakamoto. They harassed him until he became one of Bitcoin's greatest memes",653
How do whales sell off hundreds of millions worth of coins  at once?,221
JD Vance has up to $250K in Bitcoin. JD Vance net worth and stock portfolio:,316
Red alert for Ethereum as spot ETFs shed $455m in recent weeks,5
I'm convinced she's alive: Where is OneCoin's Ruja Ignatova,6
Bukele's is facing another blow to his crypto dreams: Chivo Pets shut downs.,23
What happens when a completely legitimate business is paid in stolen crypto and stablecoins?,22
Binance empowers users with vote-driven token listings and delistings,12
Michael Saylor’s Body Language Says It All During Crypto Summit,1088
Good VPS Hosting that accepts XMR? No kyc is very ideal,26
FIFA President Gianni Infantino Pitches A FIFA Coin During White House Digital Assets Summit,133
Argentine Prosecutor Investigates President Milei and the LIBRA Scandal,19
SBF sent to solitary confinement over Tucker Carlson interview: Report,146
"5 years ago today, the world's worst bandits broke into this Bitcoin ATM and left empty-handed. They were trying to ""get the coins out"" 💀",3499
What’s left,942
"Arkham adds tag for X users with over 100,000 followers to track 'key opinion leaders' in crypto",4
The crypto summit yesterday,46
"Sam Bankman-Fried Lobbying For A Pardon. Also Says Diddy Has Been ""Kind"" To Him In Prison.",284
Is Crypto a Tool for the Oligarch Takeover of the USA?,1
"US Banks can now be validators on public networks, hold crypto for customers, and hold stables",232
Crypto is Taking Over Sports — Here’s Why It’s Just the Beginning,1
The Impact of Strategic Reserve (Vol. 2)..,9
"India’s new IT bill 2025 will soon allow the govt to snoop on emails, social media, and even trading accounts! 👀🚨",36
So many people are completely missing the point of the crypto summit,45
New Bitcoin Proposal: Unlocking Dust UTXOs as Miner Transaction Fees,11
Tax help,5
"Trump's bitcoin reserve executive order hailed as 'huge moment' by some, dismissed as 'pig in lipstick' by others",855
Then and now: I decided to remaster this old comic I posted in r/cryptocurrency back in 2017. It is called 'First mover advantage'.,62
UAE Subsidiary of government owned bank Emirates NBD launches crypto offering,18
What was the point of the crypto summit?,256
Bitcoin price and active wallet count does not correlate anymore,4
Crypto Exchange Kraken is Mulling IPO in 2026: Bloomberg,40
Thoughts on the Crypto Summit held in the White House,180
"crypto.com believes their Community are Idiots: We need ""liquidity for ETFs"", so we're going to inflate our supply so that it's 500X higher than the supply of Bitcoin, we're totally not dumping on you or anything we need $5B-USD more in tokens that there is ""more liquidity""",233
New York Proposes Legislation to Shield Crypto Investors from Memecoin Scams,21
"That moment when, the US says they're not buying BTC for their Strategic Federal Reserve and the market crashes.",6069
Lawmaker Reintroduces Anti-CBDC Surveillance State Act to Block Digital Dollar,6
US Bitcoin reserve prompts $370 million in ETF outflows: Farside,28
"US Could Sell Gold, Tap Treasury Funds to Build Bitcoin Reserve: Standard Chartered",0
How Bitcoin Started - How Bitcoin Is Going,138
US regulator OCC  reaffirms banks can engage in Bitcoin & crypto services like asset custody,78
Former Georgian PM’s aide flees country after Bitcoin embezzlement allegations,2
White House Crypto Summit Bearable Guy Riddle,0
U.S. Government accumulated now over $18 Billion in Crypto,230
"Bitcoin’s a Picasso, XRP’s the Gallery, and the Maxis Are About to Eat Their Words",0
"US Treasury Chief: seized crypto assets would go into the reserve first ""then we'll see what the way forward is for more acquisitions""",242
WhiteRock leverages XRPL integration to boost speed and reliability,155
Ethereum Whales Accumulate Millions of Tokens: ETH Price Surge on the Way?,175
Let's Reboots crypto,141
"Daily Crypto Discussion - March 8, 2025 (GMT+0)",28
"White House Has a Specific Fund for Bitcoin and Another For XRP, SOL and ADA",95
SBF's Crisis Manager Resigns After Surprise Jailhouse Interview,36
America Declared the Crypto Capital of the World by Crypto Rover,4
White House: America Will Be the Bitcoin Superpower of the World – Featured Bitcoin News,0
Bitcoin Staking Platform Core Seeks APAC Expansion Through Custodian Cobo,2
Cryptocurrency exchanges in Japan,5
The surprise gambling use cases on the XAH (Xahau) network - news & opinion,0
ETH is more stable than my marriage,1793
China Holds 2x More Bitcoin Than the US Right Now - Will That Last?,146
Questions regarding coins and wallets,1
Nice,16
Everyone Wants To Know About The Crypto Summit,67
If you’re having issues with Coinbase ensure that you take pictures of all transactions and once you liquidate crypto into cash take pictures of that too.,0
"To those educated on Blockchain technology/cryptocurrencies: If governments and corporations owned 90-99% of Bitcoin but it was used as a global currency, would they be able to manipulate it in a way that fucks over the working/middle class, or is it technologically safe from power corruption?",0
New York bill aims to jail crypto fraudsters for up to 20 years,34
Trump signs executive order to establish strategic bitcoin reserve,731
Working fast to fund the stockpile?,4
Thoughts on BinoFi?,0
Next ATH using CBBI Report,20
"Today is Sam Bankman-Fried’s 33rd birthday, his 2nd in prison. Since his arrest, the entire crypto market is up by over $2 trillion 💀",4082
"Who's ready to probably, almost, maybe... call the bottom of this slump?",0
Crypto accounts whose keys were stored in Lastpass may be hacked since crooks downloaded data from there a few years back. Best to update keys and consider more secure options.,11
Bitcoin Bottom Signal: Dollar Index Sees Largest Weekly Drop,19
"In your opinion, is crypto's primary purpose for this administration to just launder money from foreign entities?",481
Technical Analysis Trader vs People Who Buy and Forget,1150
"U.S. payroll growth totals 151,000 in February, less than expected | CNBC",35
"Largest Bitcoin Wallets Holding at Least 100 BTC Fell in One Month, Says Analytics Firm – Here’s What It Means",8
"The Strategic Bitcoin Reserve is established and crypto crashes. Why this bothers me so, and why it feels like manipulation.",279
Binance's CZ Supports Combining All BROCCOLI Meme Coins Into One,0
1inch suffers $5M hack due to smart contract vulnerability,28
"Strategic Bitcoin Reserve Draws Fire: ‘Nothing New,’ Critics Say",80
Strategic Bitcoin Reserve. BULLISH!?!,3
"50% of female crypto investors eye long-term gains, survey reveals",0
United States Housing Agency wants to launch a crypto experiment,0
"FIFA shows interest in developing a FIFA token, US market in consideration",0
U.S. creates BTC strategic reserve and U.S. Digital asset stockpile(alts),219
Donald Trump’s crypto project netted $350mn from presidential memecoin (Financial Times),67
Texas Surges in U.S. States' Race to Put Public Funds Into Crypto,36
Good news. No one at the meeting will properly explain the catastrophic risks of failing to migrate to NIST latest cryptography standards,19
Someone explain the hype around this EO for me please,6
